{
  "version": "3.5",
  "authoritative_source": "config/languages/ko/k1/grammar.json",
  "authoritative_sha256": "30b04cbcd6c6e5b9ab44f27a4c4a798e054e3c5fb6999f5c73cacc4e36a898d3",
  "policy": "Only evidence-backed allowed meanings PASS. FAIL and REVIEW both prevent commit. This is a limited role/frame checker, not a complete Korean semantic parser.",
  "entries": [
    {
      "grammar_id": "ko_k1_g01",
      "surface": "이다: 이에요/예요",
      "frozen_definition": {
        "id": "ko_k1_g01",
        "form": "이다: 이에요/예요",
        "meaning_ja": "〜です",
        "category": "copula",
        "example": "여기는 우리 집이에요.",
        "notes": "名詞述語。받침あり이에요、なし예요。過去였어요/이었어요はg03と組み合わせる。否定はCore 아니다でN이/가 아니에요。"
      },
      "allowed_functions": [
        "identity"
      ],
      "disallowed_or_unapproved_functions": [
        "change",
        "existential"
      ],
      "required_context": [
        "registered nominal predicate; bound future 거 handled by g04",
        "Registered lexical identity and untouched raw morphology are required; author labels alone are insufficient."
      ],
      "positive_examples": [
        "여기는 우리 집이에요."
      ],
      "negative_examples": [
        "그 사람이 의사가 됐어요."
      ],
      "ambiguous_examples": [],
      "autocheck": "hard",
      "auto_pass_possible": true,
      "context_review_possible": true,
      "needs_human_policy": null,
      "notes": "名詞述語。받침あり이에요、なし예요。過去였어요/이었어요はg03と組み合わせる。否定はCore 아니다でN이/가 아니에요。",
      "alternate_fixture_note": null
    },
    {
      "grammar_id": "ko_k1_g02",
      "surface": "-아요/어요",
      "frozen_definition": {
        "id": "ko_k1_g02",
        "form": "-아요/어요",
        "meaning_ja": "〜ます・〜です（現在）",
        "category": "ending",
        "example": "저는 매일 학교에 가요.",
        "notes": "動詞・形容詞の해요체。하다→해요等の縮約・不規則活用を認める。独立した新文法を追加しない。"
      },
      "allowed_functions": [
        "polite_present"
      ],
      "disallowed_or_unapproved_functions": [
        "unapproved_speech_level"
      ],
      "required_context": [
        "polite terminal of a licensed predicate; tense/aspect is checked separately",
        "Registered lexical identity and untouched raw morphology are required; author labels alone are insufficient."
      ],
      "positive_examples": [
        "저는 매일 학교에 가요."
      ],
      "negative_examples": [],
      "ambiguous_examples": [],
      "autocheck": "hard",
      "auto_pass_possible": true,
      "context_review_possible": true,
      "needs_human_policy": null,
      "notes": "動詞・形容詞の해요체。하다→해요等の縮約・不規則活用を認める。独立した新文法を追加しない。",
      "alternate_fixture_note": "No forced artificial same-surface negative; invalid morphology remains the preceding gate responsibility."
    },
    {
      "grammar_id": "ko_k1_g03",
      "surface": "-았/었어요",
      "frozen_definition": {
        "id": "ko_k1_g03",
        "form": "-았/었어요",
        "meaning_ja": "〜ました・〜でした",
        "category": "tense",
        "example": "저는 어제 책을 읽었어요.",
        "notes": "했어요等の縮約を認める。経験・過去連体形や大過去-았었-は未許可。"
      },
      "allowed_functions": [
        "simple_past"
      ],
      "disallowed_or_unapproved_functions": [
        "double_past",
        "independent_experience"
      ],
      "required_context": [
        "single past marker; ordinary completed event",
        "Registered lexical identity and untouched raw morphology are required; author labels alone are insufficient."
      ],
      "positive_examples": [
        "저는 어제 책을 읽었어요."
      ],
      "negative_examples": [
        "책을 읽었었어요."
      ],
      "ambiguous_examples": [
        "이 책을 읽어 봤어요."
      ],
      "autocheck": "hard",
      "auto_pass_possible": true,
      "context_review_possible": true,
      "needs_human_policy": "g03 excludes experience in notes, while g18 explicitly licenses experiential tried-past with g03. Trial past is not auto-approved until the interpretation is confirmed.",
      "notes": "했어요等の縮約を認める。経験・過去連体形や大過去-았었-は未許可。",
      "alternate_fixture_note": null
    },
    {
      "grammar_id": "ko_k1_g04",
      "surface": "-(으)ㄹ 거예요",
      "frozen_definition": {
        "id": "ko_k1_g04",
        "form": "-(으)ㄹ 거예요",
        "meaning_ja": "〜する予定です",
        "category": "tense",
        "example": "저는 내일 학교에 갈 거예요.",
        "notes": "予定中心。推量の多用は避ける。거/것のこの構文内用法だけ許可。自由な名詞化は不可。"
      },
      "allowed_functions": [
        "future_plan"
      ],
      "disallowed_or_unapproved_functions": [
        "epistemic_conjecture"
      ],
      "required_context": [
        "explicit prospective time or first-person action plan",
        "Registered lexical identity and untouched raw morphology are required; author labels alone are insufficient."
      ],
      "positive_examples": [
        "저는 내일 학교에 갈 거예요."
      ],
      "negative_examples": [
        "지금 집에 있을 거예요."
      ],
      "ambiguous_examples": [
        "친구는 학교에 갈 거예요."
      ],
      "autocheck": "heuristic",
      "auto_pass_possible": true,
      "context_review_possible": true,
      "needs_human_policy": "Plan centered and avoid frequent conjecture do not precisely define the permitted amount of conjecture. No automatic conjecture permission.",
      "notes": "予定中心。推量の多用は避ける。거/것のこの構文内用法だけ許可。自由な名詞化は不可。",
      "alternate_fixture_note": null
    },
    {
      "grammar_id": "ko_k1_g05",
      "surface": "-고 있다",
      "frozen_definition": {
        "id": "ko_k1_g05",
        "form": "-고 있다",
        "meaning_ja": "〜しています",
        "category": "aspect",
        "example": "저는 지금 책을 읽고 있어요.",
        "notes": "進行のみ。着用・結果状態や-아/어 있다は未許可。있다は補助用言として文法内で認可。"
      },
      "allowed_functions": [
        "ongoing_action"
      ],
      "disallowed_or_unapproved_functions": [
        "result_state",
        "habitual_only"
      ],
      "required_context": [
        "action verb + current-action evidence; no habit marker without explicit now",
        "Registered lexical identity and untouched raw morphology are required; author labels alone are insufficient."
      ],
      "positive_examples": [
        "저는 지금 책을 읽고 있어요."
      ],
      "negative_examples": [
        "매일 공부하고 있어요."
      ],
      "ambiguous_examples": [
        "친구는 책을 읽고 있어요."
      ],
      "autocheck": "heuristic",
      "auto_pass_possible": true,
      "context_review_possible": true,
      "needs_human_policy": null,
      "notes": "進行のみ。着用・結果状態や-아/어 있다は未許可。있다は補助用言として文法内で認可。",
      "alternate_fixture_note": null
    },
    {
      "grammar_id": "ko_k1_g06",
      "surface": "-고 싶다",
      "frozen_definition": {
        "id": "ko_k1_g06",
        "form": "-고 싶다",
        "meaning_ja": "〜したいです",
        "category": "modality",
        "example": "저는 지금 물을 마시고 싶어요.",
        "notes": "動詞に接続。本人の希望・相手への質問を中心にする。第三者の-고 싶어하다は未許可。"
      },
      "allowed_functions": [
        "own_wish",
        "question_to_addressee"
      ],
      "disallowed_or_unapproved_functions": [
        "third_person_desiderative_derivation"
      ],
      "required_context": [
        "first-person subject or direct question to addressee",
        "Registered lexical identity and untouched raw morphology are required; author labels alone are insufficient."
      ],
      "positive_examples": [
        "저는 지금 물을 마시고 싶어요."
      ],
      "negative_examples": [
        "친구는 책을 읽고 싶어해요."
      ],
      "ambiguous_examples": [
        "친구는 책을 읽고 싶어요."
      ],
      "autocheck": "heuristic",
      "auto_pass_possible": true,
      "context_review_possible": true,
      "needs_human_policy": "Own wishes / questions to others are centered, but bare third-person -고 싶다 is not expressly banned. Treat it as needs_human_policy.",
      "notes": "動詞に接続。本人の希望・相手への質問を中心にする。第三者の-고 싶어하다は未許可。",
      "alternate_fixture_note": null
    },
    {
      "grammar_id": "ko_k1_g07",
      "surface": "안",
      "frozen_definition": {
        "id": "ko_k1_g07",
        "form": "안",
        "meaning_ja": "〜しません・〜くありません",
        "category": "negation",
        "example": "저는 오늘 학교에 안 가요.",
        "notes": "短形否定。名詞+하다語では공부 안 해요等を認めるが、否定できない語に機械的に付けない。-지 않다は未許可。"
      },
      "allowed_functions": [
        "short_negation"
      ],
      "disallowed_or_unapproved_functions": [
        "long_negation"
      ],
      "required_context": [
        "안 attached to a licensed negatable predicate",
        "Registered lexical identity and untouched raw morphology are required; author labels alone are insufficient."
      ],
      "positive_examples": [
        "저는 오늘 학교에 안 가요."
      ],
      "negative_examples": [
        "학교에 가지 않아요."
      ],
      "ambiguous_examples": [],
      "autocheck": "hard",
      "auto_pass_possible": true,
      "context_review_possible": true,
      "needs_human_policy": null,
      "notes": "短形否定。名詞+하다語では공부 안 해요等を認めるが、否定できない語に機械的に付けない。-지 않다は未許可。",
      "alternate_fixture_note": null
    },
    {
      "grammar_id": "ko_k1_g08",
      "surface": "못",
      "frozen_definition": {
        "id": "ko_k1_g08",
        "form": "못",
        "meaning_ja": "〜できません",
        "category": "negation",
        "example": "저는 오늘 학교에 못 가요.",
        "notes": "動詞の不可能のみ。能力・状況による不可能。形容詞への一律付加は禁止。"
      },
      "allowed_functions": [
        "capacity_or_circumstance_inability"
      ],
      "disallowed_or_unapproved_functions": [
        "adjective_inability"
      ],
      "required_context": [
        "action verb; capacity or circumstances",
        "Registered lexical identity and untouched raw morphology are required; author labels alone are insufficient."
      ],
      "positive_examples": [
        "저는 오늘 학교에 못 가요."
      ],
      "negative_examples": [
        "방이 못 커요."
      ],
      "ambiguous_examples": [],
      "autocheck": "hard",
      "auto_pass_possible": true,